File, Title, Author, Time, review
animalfarm.txt,Animal Farm,George Orwell,2023-10-08 10:55:08.661453,"The chapters and passages reviewed in this analysis effectively set up the conflict and plot of the story, introduce key characters and events, and keep the reader engaged throughout. The length of each chapter or passage is appropriate, allowing for the development of plot points and the introduction of new elements. The readability of the writing is generally good, with clear and concise language that is easy to follow. However, there are instances where the sentence structure or complexity of language may require rereading for full comprehension. The pacing of each chapter or passage is well done, with a good balance between exposition and action. However, there are moments where the pacing slows down or feels rushed, which could be improved for a more consistent flow. Overall, the chapters and passages reviewed effectively set the stage for the rest of the story, engage the reader, and provide a unique and thought-provoking read."
thehareandthetortoise.txt, The Hare and the Tortoise, Aesop, 2023-10-08 11:57:02.328926, "The pacing of the story is well-balanced with a gradual build-up of tension and a satisfying resolution. The initial banter between the Hare and the Tortoise sets the stage for the race and the plot unfolds smoothly as they agree to compete. The introduction of the fox as the judge adds an element of fairness to the race. The length of the story is just right allowing for a concise and impactful narrative. The vocabulary used is simple yet effective making it accessible to readers of all ages. One minor drawback is that the story lacks depth in terms of character development. The Hare and the Tortoise are portrayed as one-dimensional characters with the Hare being overconfident and the Tortoise being determined. It would have been interesting to see more complexity in their personalities. Additionally the story could have benefited from more descriptive details to enhance the reader's engagement. While the focus is on the pacing and plot a few vivid descriptions of the surroundings or the characters' actions could have added depth to the story. Overall 'A Hare and a Tortoise' is a classic fable that effectively conveys the moral of 'slow and steady wins the race.' The pacing and plot are well-executed although the story could have been enhanced with more character development and descriptive details."

THE LION AND THE MOUSE.txt,The Lion and The Mouse,Aesop,2023-10-08 13:37:16.674894,"""The Lion and the Mouse"" is a short fable that manages to pack a powerful message within its concise length. The pacing of the story is excellent, with each event flowing seamlessly into the next, keeping the reader engaged from start to finish. The readability of the fable is also commendable, as the language used is simple yet effective in conveying the moral lesson.

One of the strengths of this fable is its ability to capture the reader's attention with its intriguing plot. The initial encounter between the Lion and the Mouse sets the stage for the unexpected turn of events that follow. The contrast between the powerful Lion and the seemingly insignificant Mouse adds an element of surprise and curiosity to the story.

The fable also effectively explores the theme of kindness and the importance of not underestimating others. The Lion's initial dismissal of the Mouse's plea for mercy serves as a reminder that even the smallest acts of kindness can have significant consequences. The eventual role reversal, where the Mouse saves the Lion from a life-threatening situation, beautifully illustrates the power of gratitude and the potential for help to come from unexpected sources.

However, one minor drawback of this fable is its brevity. While the concise nature of the story adds to its impact, some readers may find themselves craving more depth and development in the characters and their motivations. Additionally, the lack of chapter breaks or clear sections may make it difficult for readers to navigate through the fable, especially if they prefer a more structured reading experience.

In conclusion, ""The Lion and the Mouse"" is a captivating fable that effectively explores themes of kindness and underestimation. Its pacing and readability make it an enjoyable read, although some readers may desire more length and character development. Overall, this fable serves as a valuable reminder of the potential for help and kindness to come from the most unexpected places."

THE HARE AND THE TORTOISE.txt,The hare and the tortoise,Aesop,2023-10-08 13:40:37.090629,"In this fable, the story revolves around a Hare and a Tortoise engaging in a race, with the Tortoise emerging as the unexpected victor. The narrative is concise and easy to follow, making it accessible to readers of all ages. The pacing of the story is well-maintained, with a gradual build-up of tension as the race progresses.

The vocabulary used in the fable is simple yet effective, allowing readers to grasp the moral lesson without any confusion. The author's choice of words enhances the readability of the story, making it an enjoyable experience for both children and adults.

One minor drawback of the fable is the lack of character development. The Hare and the Tortoise are portrayed as one-dimensional characters, with no significant growth or transformation throughout the story. This could potentially limit the emotional connection readers may have with the characters.

Additionally, the fable could benefit from a more detailed description of the racecourse. While the focus of the story is on the moral lesson, a vivid depiction of the surroundings could have added depth to the narrative and engaged readers on a visual level.

Overall, ""A Hare and a Tortoise"" is a timeless fable that effectively conveys the message of perseverance and the importance of not underestimating others. Its simplicity and brevity make it an ideal choice for those seeking a quick yet impactful read."
